{
  "protocol_version": "2.5",
  "task_network_plan_id": "0aa341106cfc5b104ab9ca9c2ae116d490a258685e28d26d5435860c53bb12aa",
  "transport_mode": "BRANCH_GITOPS",
  "base_runtime_state_id": "9d0a88cc9001295b5e4c0f4163e83c0fd64ce04521e34230ad3539af14f3dfaf",
  "runtime_state_id": "9d0a88cc9001295b5e4c0f4163e83c0fd64ce04521e34230ad3539af14f3dfaf",
  "foundry_sha256": "57c57394bda484c4ec4613c312080682a37670ebb6cec06d061979e39f1ec64f",
  "mastermind_sha256": "026a4d845ac021baa9f90c7c48c1f77f19f57065d257e45824025f5f467a9d0d",
  "actual_runtime_plan_id": "f0031a07c1cfb23a8183e393b3ef26c92cd7cfa7b64e00af4466b52d90dc02d8",
  "accepted_network_checkpoint_id": "59e43885d42bf8da755acb0792272913d95d50f7ed013c702364f38ce2eef905",
  "network_mode": "BENCHMARK_DISCOVERY_WAIT",
  "generation_seq": 8,
  "active_parent_state_git_identity": "856481759722e23ff9a652ce140f304efe13b023",
  "canonical_bus_repo": "Kitahl/Project-supernova-",
  "private_vault_repo": "Kitahl/thoma",
  "active_cohort_id": "STAGE-BR-008-v25-MF311",
  "generation_branch": "ps/gen/STAGE-BR-008-v25-MF311",
  "generation_head_sha": "6325824aac035d190dbfb0a54b9eca49af36c046",
  "active_control_manifest_path": "control/STAGE-BR-008-v25-MF311.json",
  "active_control_manifest_git_identity": "2d1aea6201cde61f7e0b826295c69d130476518a",
  "active_assignment_path": "assignments/STAGE-BR-008-v25-MF311.json",
  "active_assignment_git_identity": "43654f10b59e5550731542b48cab13d9e221afce",
  "worker_branches": {
    "MF01": "ps/work/STAGE-BR-008-v25-MF311/MF01",
    "MF02": "ps/work/STAGE-BR-008-v25-MF311/MF02",
    "MF03": "ps/work/STAGE-BR-008-v25-MF311/MF03",
    "MF04": "ps/work/STAGE-BR-008-v25-MF311/MF04",
    "MF05": "ps/work/STAGE-BR-008-v25-MF311/MF05",
    "MM01": "ps/work/STAGE-BR-008-v25-MF311/MM01",
    "MM02": "ps/work/STAGE-BR-008-v25-MF311/MM02",
    "MM03": "ps/work/STAGE-BR-008-v25-MF311/MM03",
    "MM04": "ps/work/STAGE-BR-008-v25-MF311/MM04",
    "MM05": "ps/work/STAGE-BR-008-v25-MF311/MM05",
    "MM07": "ps/work/STAGE-BR-008-v25-MF311/MM07",
    "EXT01": "ps/work/STAGE-BR-008-v25-MF311/EXT01"
  },
  "verifier_branch": "ps/verify/STAGE-BR-008-v25-MF311",
  "integrator_branch": "ps/integrate/STAGE-BR-008-v25-MF311",
  "consolidation_branch": "ps/consolidate/STAGE-BR-008-v25-MF311",
  "benchmark_registry_path": "benchmark/registry.json",
  "benchmark_registry_git_identity": "461c5bd695df5ac849e27df80799ed12871d281a",
  "fresh_allowed_globally": false,
  "calibration_required_clean_cohorts": 2,
  "calibration_streak": 0,
  "calibration_countable_current": false,
  "repo_policy_status": "VERIFIED_PROTECTED_SOURCE_BOUND",
  "superseded_cohorts": [
    "CAL-001",
    "CAL-002",
    "CAL-003-810da70a",
    "CAL-004-bcedd2a9",
    "CAL-005-7fff4d30",
    "CAL-BR-006-433ad83a",
    "CAL-BR-006-v251-433ad83a",
    "CAL-BR-007-v25-c13b6ee4"
  ],
  "current_runtime_blocker": "O-T0-MF311_STAGING_TO_COUNTABLE_RESTART",
  "last_deep_research_path": null,
  "last_deep_research_time_vancouver": null,
  "deep_research_owner": "BIL00",
  "deep_research_times_vancouver": ["00:58", "12:58"],
  "public_repo_safety": "OPAQUE_PROTECTED_REFERENCES_ONLY",
  "worker_auth_scheme": "PS-HMAC-SHA256-CANONICAL-REPORT-2",
  "goal1_status": "BLOCKED_T0",
  "goal2_status": "BLOCKED_BY_GOAL1",
  "runtime_update_receipt_path": "runtime/updates/GEN8-FOUNDRY-3.1.1-REPLAY-BINDING.json",
  "expected_base_head": "821d4a42c6302640cf5995ec2b3b41bd01346c42",
  "authority_note": "Non-countable zero-credit Math Foundry 3.1.1 substrate staging. Immutable invalidated Gen7 is superseded with zero calibration/fresh/scientific credit. No worker execution is authorized in this generation. Next action is opening the first repaired countable v2.5 replay cohort with frozen liveness."
}
